{
  "schema_version": "scope-explanation.v1",
  "explanation_id": "scope-20260514-000002Z",
  "observed_at": "2026-05-14T00:00:00Z",
  "host": "heim-pc",
  "source_refs": [
    "local_config.canonical_repo_roots",
    "local_config.excluded_repo_roots",
    "filesystem.path",
    "git.rev_parse.worktree"
  ],
  "input_path": "/home/alex/GDrive/repos/steuerboard",
  "normalized_path": "/home/alex/GDrive/repos/steuerboard",
  "is_git_repo": false,
  "git_toplevel": null,
  "scope": "scope_excluded",
  "scope_reason": "under excluded_repo_roots",
  "matched_policy": {
    "kind": "excluded_repo_roots",
    "value": "/home/alex/GDrive/repos"
  }
}
