{
  "schema_version": "scope-explanation.v1",
  "explanation_id": "scope-20260514-000003Z",
  "observed_at": "2026-05-14T00:00:00Z",
  "host": "heim-pc",
  "source_refs": [
    "local_config.canonical_repo_roots",
    "local_config.excluded_repo_roots",
    "filesystem.path",
    "git.rev_parse.worktree"
  ],
  "input_path": "/tmp/not-in-policy",
  "normalized_path": "/tmp/not-in-policy",
  "is_git_repo": false,
  "git_toplevel": null,
  "scope": "scope_unknown",
  "scope_reason": "outside configured roots",
  "matched_policy": {
    "kind": "none",
    "value": null
  }
}
